{
  "$schema": "https://json-schema.org/draft/2020-12/schema",
  "$id": "royal-capital.fortification.mixed-span-fixture/1",
  "type": "object",
  "required": ["schema", "assembly_id", "frame", "root_module_id", "root_transform", "modules", "connections", "segmentation", "tolerances", "budget", "runtime"],
  "additionalProperties": false,
  "properties": {
    "schema": {"const": "royal-capital.fortification.mixed-span-fixture/1"},
    "assembly_id": {"type": "string", "minLength": 1},
    "frame": {"const": "RH_X_RIGHT_Y_UP_NEG_Z_FORWARD"},
    "root_module_id": {"type": "string", "minLength": 1},
    "root_transform": {"type": "object"},
    "modules": {"type": "array", "minItems": 1},
    "connections": {"type": "array"},
    "segmentation": {"type": "object"},
    "tolerances": {"type": "object"},
    "budget": {"type": "object"},
    "runtime": {"type": "object"}
  }
}
