{
  "assembly_id": "fortification/caelmere/r0b/mixed-span-closeout-001",
  "budget": {
    "max_artifact_bytes": 250000000,
    "max_coverage_rows": 4096,
    "max_modules": 32,
    "max_triangles": 2000000,
    "max_vertices": 2000000
  },
  "connections": [
    {
      "from_module": "span/stepped",
      "from_socket": "span_end",
      "to_module": "span/retaining",
      "to_socket": "span_start"
    },
    {
      "from_module": "span/straight",
      "from_socket": "span_end",
      "to_module": "join/miter",
      "to_socket": "incoming_span"
    },
    {
      "from_module": "span/retaining",
      "from_socket": "span_end",
      "to_module": "join/transition",
      "to_socket": "incoming_span"
    },
    {
      "from_module": "join/miter",
      "from_socket": "outgoing_span",
      "to_module": "span/curved",
      "to_socket": "span_start"
    },
    {
      "from_module": "span/curved",
      "from_socket": "span_end",
      "to_module": "join/bevel",
      "to_socket": "incoming_span"
    },
    {
      "from_module": "join/bevel",
      "from_socket": "outgoing_span",
      "to_module": "span/stepped",
      "to_socket": "span_start"
    }
  ],
  "frame": "RH_X_RIGHT_Y_UP_NEG_Z_FORWARD",
  "modules": [
    {
      "family": "BEVEL",
      "input_socket": "incoming_span",
      "module_id": "join/bevel",
      "module_kind": "JOIN",
      "output_socket": "outgoing_span",
      "required": true,
      "source_dir": "r0b_cp2/outputs/bevel/reference",
      "source_mesh_sha256": "sha256:d9e66b885a63a45f1fee86c8dfc5132da911559c95ba3e38288a3f94fb22474b",
      "source_result_sha256": "sha256:9be1b595e64c2f5f8e64eb7c65bfd458736289dba887ca9354231515a600c0ca",
      "station": {
        "anchor_m": 49.132741229
      }
    },
    {
      "family": "STRAIGHT_SPAN",
      "input_socket": "span_start",
      "module_id": "span/straight",
      "module_kind": "PATH_SPAN",
      "output_socket": "span_end",
      "required": true,
      "source_dir": "r0b_cp1/outputs/straight/reference",
      "source_mesh_sha256": "sha256:4860acac80995d57352628d4062bbfd0de19c996b1e692a2abe536ccece8634d",
      "source_result_sha256": "sha256:5d7a6ddf47aa4ec4f3109792db8ec232fc923bc0ed9cabe4a0bebf528f088a0f",
      "station": {
        "end_m": 24.0,
        "start_m": 0.0
      }
    },
    {
      "family": "RETAINING",
      "input_socket": "span_start",
      "module_id": "span/retaining",
      "module_kind": "TERRAIN_SPAN",
      "output_socket": "span_end",
      "required": true,
      "source_dir": "r0b_cp3/outputs/retaining/reference",
      "source_mesh_sha256": "sha256:63cee46cde71f45880a9e9b49be42693b79a376afd4bd10d7b61ecb0cc6803fc",
      "source_result_sha256": "sha256:97a66b2799cfedbe2677599609824589854fe494730eb44ca2d89d680132e630",
      "station": {
        "end_m": 103.132741229,
        "start_m": 79.132741229
      }
    },
    {
      "family": "MITER",
      "input_socket": "incoming_span",
      "module_id": "join/miter",
      "module_kind": "JOIN",
      "output_socket": "outgoing_span",
      "required": true,
      "source_dir": "r0b_cp2/outputs/miter/reference",
      "source_mesh_sha256": "sha256:ae8be5380035d76e75320eee9db83a6129871601c0090f6250cb2abf3dc59b2a",
      "source_result_sha256": "sha256:f4c166aad1df2245d0803419e729a1358e21f4431249d4ac263a9e799736b352",
      "station": {
        "anchor_m": 24.0
      }
    },
    {
      "family": "PROFILE_TRANSITION",
      "input_socket": "incoming_span",
      "module_id": "join/transition",
      "module_kind": "JOIN",
      "output_socket": "outgoing_span",
      "required": true,
      "source_dir": "r0b_cp2/outputs/transition/reference",
      "source_mesh_sha256": "sha256:b884890ce44f3fcef7d9ab75f75b522044d3c7c4f7c0dda8d2b0ec0f3ebf868f",
      "source_result_sha256": "sha256:eb63d968a736f6cfb4da9c4f0cd266809aab861679598d08867ed544e5068a2a",
      "station": {
        "anchor_m": 103.132741229
      }
    },
    {
      "family": "TERRAIN_STEPPED",
      "input_socket": "span_start",
      "module_id": "span/stepped",
      "module_kind": "TERRAIN_SPAN",
      "output_socket": "span_end",
      "required": true,
      "source_dir": "r0b_cp3/outputs/stepped/reference",
      "source_mesh_sha256": "sha256:390e6c480433fd24b697f60a59a3a4663fc7601fb2f0fb506daf2592fb36dd8c",
      "source_result_sha256": "sha256:d0c019f50412d913761c16b825d2baf5ebab62f5bb43575e3b5d7374b1a9d738",
      "station": {
        "end_m": 79.132741229,
        "start_m": 49.132741229
      }
    },
    {
      "family": "CURVED_SPAN",
      "input_socket": "span_start",
      "module_id": "span/curved",
      "module_kind": "PATH_SPAN",
      "output_socket": "span_end",
      "required": true,
      "source_dir": "r0b_cp1/outputs/curved/reference",
      "source_mesh_sha256": "sha256:21781d0c24aec04f31e4f76b55a2411218b87ff3f21dd6b92c1f25dd4f89f28f",
      "source_result_sha256": "sha256:5b1081352a342346ae4871832076e5bef452f6c0f6fc556ae52ab0c80b2bde8d",
      "station": {
        "end_m": 49.132741229,
        "start_m": 24.0
      }
    }
  ],
  "root_module_id": "span/straight",
  "root_transform": {
    "heading_deg": 0.0,
    "translation_m": [
      0.0,
      0.0,
      0.0
    ]
  },
  "runtime": {
    "build123d_source_commit": "e22d34dae17111e5b9fdb361317e055d0daae466",
    "build123d_version": "0.13.1.dev12+ge22d34dae",
    "ocp_version": "8.0.1.0.0",
    "ocp_wheel_sha256": "1702dfc8f5bdcb916ce65ea0c6314fe453cc78a6a3d49a044fb3062d47b0ef9f"
  },
  "schema": "royal-capital.fortification.mixed-span-fixture/1",
  "segmentation": {
    "array_order_is_identity": false,
    "max_modules": 32,
    "max_span_length_m": 60.0,
    "require_contiguous_span_intervals": true
  },
  "tolerances": {
    "angular_rad": 1e-06,
    "linear_m": 1e-06,
    "mesh_round_digits": 9,
    "station_m": 1e-06
  }
}
